Company,CrunchBase Profile,Image,Tagline,Year Founded,Market Categories,Address (HQ),City (HQ),State / Region (HQ),Country (HQ),Description,Homepage,Twitter,Acquired by,Acquisitions ID,API
Lotus Development Corporation,http://www.crunchbase.com/organization/lotus-development-corporation,,Lotus Software is a software company specialized in Lotus 1-2-3 spreadsheet application.,1982.0,Enterprise Software,,,,,"Lotus Software called Lotus Development Corporation before its acquisition by IBM is a software company with headquarters in Westford, Massachusetts. Lotus is most commonly known for the Lotus 1-2-3 spreadsheet application, the first feature-heavy, user friendly, reliable and WYSIWYG-enabled product to become widely available in the early days of the IBM PC, when there was no Graphical User Interface. Such a useful tool certainly helped to spread the adoption of the PC, both for administrative and scientific applications. Much later, in conjunction with Ray Ozzie's Iris Associates, Lotus also released a groupware and email system, Lotus Notes. IBM purchased the company in 1995 for $3.5 billion, primarily to acquire Lotus Notes and to establish a presence in the increasingly important client-server computing segment, which was rapidly making host-based products like IBM's OfficeVision obsolete.Source: Wikipedia_Development_Corporation, accessed 2/12/10.",http://www.lotus.com,,IBM,IBM acquired Lotus Development Corporation in 1995,http://api.crunchbase.com/v/2/organization/lotus-development-corporation?user_key=0ebdc8274e821149894a240090945265
Netezza,http://www.crunchbase.com/organization/netezza,"http://a2.images.crunchbase.com/image/upload/c_pad,h_500,w_500/v1397203824/2460b56a0587b4a19c02b0510bfbfb2f.png",Netezza is a company providing optimized data warehouse applications for companies to store vast amounts of information.,2000.0,"Big Data, Analytics, Storage, Databases, Enterprise Software","26 Forest Street, Marlborough, Massachusetts, United States",Marlborough,Massachusetts,United States,"Netezza provides optimized data warehouse applications for companies to store vast amounts of information.  They combine storage, processing, and analytics into one system for better performance and efficiency.",http://www.netezza.com,http://twitter.com/IBMNetezza,IBM,IBM acquired Netezza in 2010,http://api.crunchbase.com/v/2/organization/netezza?user_key=0ebdc8274e821149894a240090945265
SPSS,http://www.crunchbase.com/organization/spss,"http://a3.images.crunchbase.com/image/upload/c_pad,h_500,w_500/v1397190991/2001b27015bac5c9e16d067d61ff25e5.png","SPSS provides predictive analytics software and solutions for survey authoring and deployment, data mining, and text analytics.",1968.0,Software,"233 S. Wacker Drive, 11th Floor, Chicago, Illinois, United States",Chicago,Illinois,United States,"SPSS Inc. is a leading worldwide provider of predictive analytics software and solutions. Founded in 1968, today SPSS has more than 250,000 customers worldwide, served by more than 1,200 employees in 60 countries.",http://www.spss.com,,IBM,IBM acquired SPSS in 2009,http://api.crunchbase.com/v/2/organization/spss?user_key=0ebdc8274e821149894a240090945265
Storwize,http://www.crunchbase.com/organization/storwize,"http://a4.images.crunchbase.com/image/upload/c_pad,h_500,w_500/v1397201484/091e2f1e85f451d08f6823e9381cf503.jpg",Storwize is a provider of real-time data compression solutions that boost storage space on network storage environments.,2004.0,"Storage, None","225 Cedar Hill Street, Suite 200, Marlborough, Massachusetts, United States",Marlborough,Massachusetts,United States,"Storwize, Inc. is the only provider of real-time data compression solutions that dramatically boost storage space on network storage environments. Storwize appliances are installed between the organization's storage arrays and their network. Designed to work with any storage array it is connected to, the Storwize appliance typically provides organizations with 2-5X additional capacity with associated savings in capital, operational, maintenance and management resources. Storwize solutions have been shipped to customer sites worldwide and successfully tested for interoperability with leading storage vendors such as EMC and NetApp. Storwize has won several coveted industry honors from analyst firms and leading IT publications, and added multiple new customers in different vertical markets worldwide.Increase the effective capacity of existing NAS infrastructure up to 15x with Storwize's STN-6000p capacity optimization platform featuring real-time lossless data compression. Based upon a powerful multi-core hardware platform, the STN-6000p appliance is deployed between the network, switch and storage providing average data compression of &gt; 65% across multiple applications and more than 90% on business critical applications without performance degradation, enabling it to be deployed in even the most data intensive enterprise environments. The appliance does not require workflow changes, software agents or server drivers and can be deployed seamlessly without any configuration changes to existing environments.",http://www.storwize.com,http://twitter.com/storwize,IBM,IBM acquired Storwize in 2010,http://api.crunchbase.com/v/2/organization/storwize?user_key=0ebdc8274e821149894a240090945265
Trusteer,http://www.crunchbase.com/organization/trusteer,"http://a4.images.crunchbase.com/image/upload/c_pad,h_500,w_500/v1397195142/04d0280b7e4977b0de979f7859698a27.png","Trusteer helps online banks, brokerages and retailers secure the consumer desktop from financial malware attacks and fraudulent websites.",2006.0,"Banking, Security","545 Boylston Street, Suite 500, Boston, Massachusetts, United States",Boston,Massachusetts,United States,"Trusteer helps online banks, brokerages, and retailers secure the consumer desktop from financial malware attacks and fraudulent websites.Trusteer's customers include ING DIRECT, the nation's largest direct bank and other leading online banks, brokerages, and Internet companies.",http://www.trusteer.com,http://twitter.com/Trusteer,IBM,IBM acquired Trusteer in 2013,http://api.crunchbase.com/v/2/organization/trusteer?user_key=0ebdc8274e821149894a240090945265
Unica,http://www.crunchbase.com/organization/unica,"http://a3.images.crunchbase.com/image/upload/c_pad,h_500,w_500/v1397186640/0bef4c61d167a6bfd51d65efa2857614.png",Unica offers enterprise marketing management and cloud-based marketing solutions to companies and different industries.,,"Marketing Automation, Lead Generation, Software","170 Tracer Lane, Reservoir Place North, Waltham, Massachusetts, United States",Waltham,Massachusetts,United States,"Unica Corporation provides enterprise marketing management software to financial services, insurance, retail, telecommunications, and travel and hospitality industries worldwide. The company's software consists of seven modules: Campaign, Marketing Operations, Detect, Leads, NetInsight, CustomerInsight, and PredictiveInsight. The Campaign module allows marketing organizations to create, test, and execute customer interaction strategies across outbound and inbound touch points. The Marketing Operations module provides marketing operations and resource management capabilities that help marketers define, co-ordinate, monitor, control, and measure marketing program activities. The Detect module monitors high-volumes of transactional data to identify changes in behavior over time that signal a need to interact with a customer for sales or service opportunities. The Leads module enables marketers to manage the qualification, distribution, and maturation of leads between marketing activities and multiple sales channels. The NetInsight module collects, analyzes, and reports on Web site activity. The CustomerInsight module provides analytics for marketing performance management and cross-channel customer analysis through a visually intuitive interface. The PredictiveInsight module enables marketing organizations to automate the creation of predictive models to determine customer response propensities, recognize customers at risk of attrition, identify customer behaviors, analyze customer attributes and preferences, discover cross-selling opportunities, and forecast customer value. The company also provides implementation, training, consulting, maintenance, and technical support services. It offers its software through a direct sales force, as well as through alliances with marketing service providers, distributors, and systems integrators. The company was incorporated in 1992 and is headquartered in Waltham, Massachusetts.",http://www.unica.com,,IBM,IBM acquired Unica in 2010,http://api.crunchbase.com/v/2/organization/unica?user_key=0ebdc8274e821149894a240090945265
XIV,http://www.crunchbase.com/organization/xiv,"http://a5.images.crunchbase.com/image/upload/c_pad,h_500,w_500/v1397200961/0e070eb416418e9dc50b2a0dae72b4ed.gif",Enterprise storage,,Web Hosting,,,,,,,,IBM,IBM acquired XIV in 2008,http://api.crunchbase.com/v/2/organization/xiv?user_key=0ebdc8274e821149894a240090945265
Aepona,http://www.crunchbase.com/organization/aepona,"http://a5.images.crunchbase.com/image/upload/c_pad,h_500,w_500/v1397204750/5dce8ac3e77445e2bdffdfa77661992e.png","Aepona provides cloud-computing and related services, offering network and API monetization assistance for telecommunications operators.",1999.0,Web Hosting,"20-24 York Street, Interpoint Building, Belfast, Belfast, Great Britain",Belfast,Belfast,Great Britain,"Aepona Ltd. provides application-led products and services to telecommunications operators worldwide. Its Universal Service Platform allows service creation and implementation to be carried out within the service network from underlying network resources. Aepona, Ltd. serves customers in Europe, North America, and South East Asia. The company was founded in 1999 and is headquartered in Belfast, United Kingdom. Aepona Ltd. is a former subsidiary of ApiON Ltd.",http://www.aepona.com,http://twitter.com/Aepona,Intel,Intel acquired Aepona in 2013,http://api.crunchbase.com/v/2/organization/aepona?user_key=0ebdc8274e821149894a240090945265
Basis Science,http://www.crunchbase.com/organization/basis-science,"http://a4.images.crunchbase.com/image/upload/c_pad,h_500,w_500/v1397185595/a28fec3aeb9f440f89f04c7fd56c5266.png",Basis Science offers a wrist-based health tracker and online dashboard for people to incorporate healthy habits into their daily routine.,2010.0,Health and Wellness,"1200 Folsom Street, San Francisco, California, United States",San Francisco,California,United States,"At Basis our mission is to help fit health into our busy lives. We designed our wrist-based health tracker and online personal dashboard to help you easily incorporate healthy habits into your daily routine.Basis leverages four types of advanced sensors in its lightweight, customizable design to calculate steps taken, calories burned and sleep quality, as well as physiological metrics like heart rate. We help you set new health goals and automatically adjust weekly targets based on your progress. Using this flexible approach you’ll build healthy habits you can maintain for years.Basis Science, Inc. is backed by Norwest Venture Partners and Doll Capital Management.",http://mybasis.com,http://twitter.com/mybasis,Intel,Intel acquired Basis Science in 2014,http://api.crunchbase.com/v/2/organization/basis-science?user_key=0ebdc8274e821149894a240090945265
CognoVision,http://www.crunchbase.com/organization/cognovision,"http://a2.images.crunchbase.com/image/upload/c_pad,h_500,w_500/v1397196522/7a684dd6503c348216106be6c0305d91.jpg",CognoVision provides real-time automated audience measurement and targeting solutions for the out-of-home advertising industry.,2006.0,"Advertising, Digital Signage, Software","15 Allstate Parkway, 6th Floor, Markham, Ontario, Canada",Markham,Ontario,Canada,"CognoVision is a provider of real-time automated audience measurement and targeting solutions for the out-of-home advertising industry. Our solutions allow retailers, advertisers, digital signage networks, media planners, and market research companies to measure the effectiveness of their displays at engaging the attention of an audience, and enable digital displays to target content based on audience characteristics. We deliver accurate viewing metrics for a variety of media delivery methods including digital screens, posters, and product displays.",http://www.cognovision.com,http://twitter.com/IntelAIMSuite,Intel,Intel acquired CognoVision in 2010,http://api.crunchbase.com/v/2/organization/cognovision?user_key=0ebdc8274e821149894a240090945265
Indisys,http://www.crunchbase.com/organization/indisys,"http://a2.images.crunchbase.com/image/upload/c_pad,h_500,w_500/v1397181439/52df35050c337be5866336a9b52eb6cb.png",Indisys develops natural language processing technologies that facilitate intelligent user interaction with computer systems.,2005.0,"Systems, Software, Enterprise Software","Edificio DTM, Av. de los Descubrimientos Nº11, Seville, Andalucia, Spain",Seville,Andalucia,Spain,"Indisys has developed a unique technology that breaks with many of the existing barriers in other dialogue systems, combining technology in Artificial Intelligence, Natural Language Processing and Cognitive Science, in User Centered Design UCD and a great experience the needs of customers and end users.Their mission is to provide quality solutions in environments where the Natural Language and Intelligent Dialogue can greatly facilitate users interaction with computer systems.",http://www.indisys.es,http://twitter.com/Indisys,Intel,Intel acquired Indisys in 2013,http://api.crunchbase.com/v/2/organization/indisys?user_key=0ebdc8274e821149894a240090945265
Infineon Technologies,http://www.crunchbase.com/organization/infineon,"http://a2.images.crunchbase.com/image/upload/c_pad,h_500,w_500/v1397183702/79bc5b009247cfd1a274f2a328ff17bf.png",Semiconductor and System Solutions,1999.0,Semiconductors,"Am Campeon 1-12, Neubiberg, Bayern, Germany",Neubiberg,Bayern,Germany,"Infineon Technologies focuses on the three central challenges facing modern society Energy Efficiency, Communications and Security and offers semiconductors and system solutions for automotive and industrial electronics, chip card and security applications as well as applications in communications.",http://www.infineon.com,http://twitter.com/Infineon,Intel,Intel acquired Infineon Technologies in 2010,http://api.crunchbase.com/v/2/organization/infineon?user_key=0ebdc8274e821149894a240090945265
iPivot,http://www.crunchbase.com/organization/ipivot,"http://a3.images.crunchbase.com/image/upload/c_pad,h_500,w_500/v1397191036/e5521778569ce70a2ab7eee758d60ef5.png",iPivot developed traffic management technology for e-commerce systems.,,E-Commerce,,,,,iPivot developed traffic management technology for e-commerce systems.,,,Intel,Intel acquired iPivot in 1999,http://api.crunchbase.com/v/2/organization/ipivot?user_key=0ebdc8274e821149894a240090945265
NetEffect,http://www.crunchbase.com/organization/neteffect,,NetEffect is a network connectivity solutions provider developing multi-gigabit Ethernet products.,1999.0,Web Hosting,"9211 Waterford Centre Boulevard, Suite 100, Austin, Texas, United States",Austin,Texas,United States,"NetEffect, Inc. operates as a network connectivity solutions company. The company develops and provides multi-gigabit Ethernet products. It offers iWARP Ethernet Channel Adapters, which simplify datacenter management by enabling a single, consolidated fabric for networking, storage, and clustering applications. The company's products implement IETF for Ethernet, while maintaining with existing Ethernet infrastructure in data center. It also provides data networking, cluster computing, and storage networking solutions. The company has strategic partnerships with ABAQUS; Blade.org; Ciara Technologies; Critical Software; Evergrid; Force10 Networks; Fujitsu Computer Products of America, Inc.; Fulcrum Microsystems; HP BladeSystem Solution Builder; Quadrics; VMware; and Woven Systems. The company was formerly known as Banderacom, Inc. and changed its name to NetEffect, Inc. in 2004. NetEffect, Inc. was founded in 1999 and is based in Austin, Texas. On August 27, 2008, NetEffect Inc. filed a voluntary petition for reorganization under Chapter 11 in the U.S. Bankruptcy Court for the District of Delaware. As of October 14, 2008, NetEffect, Inc. operates as a subsidiary of Intel Corporation.",http://www.neteffect.com,,Intel,Intel acquired NetEffect in 2008,http://api.crunchbase.com/v/2/organization/neteffect?user_key=0ebdc8274e821149894a240090945265
Omek Interactive,http://www.crunchbase.com/organization/omek-interactive,"http://a3.images.crunchbase.com/image/upload/c_pad,h_500,w_500/v1397181616/caffd0022f472fabe69da09efb6e22b5.png",Omek Interactive provides tools and technology that enable software developers to add gesture-based interfaces to their products.,2007.0,Software,"2 Hahar Street, Ganir Cente, Industrial Zone Har Tuv A, Bet Shemesh, Yerushalayim, Israel",Bet Shemesh,Yerushalayim,Israel,"Omek Interactive provides tools and technology that enable manufacturers and software developers to add gesture-based interfaces to their products. Omek's gesture recognition and body tracking software is being incorporated into a broad range of devices  &  from TVs, set-top boxes and game consoles, to tablets, notebooks and PCs, smartphones, interactive signs, medical and fitness devices, and more. The gesture-enabled applications running on these devices include games, advertising, physical therapy,home and factory automation, security and surveillance, virtual fitting, and beyond. Omek's tools work with all major 3D cameras, and support a broad range of processors and operating systems.",http://www.omekinteractive.com,http://twitter.com/OmekInteractive,Intel,Intel acquired Omek Interactive in 2013,http://api.crunchbase.com/v/2/organization/omek-interactive?user_key=0ebdc8274e821149894a240090945265
Sensory Networks,http://www.crunchbase.com/organization/sensory-networks,"http://a1.images.crunchbase.com/image/upload/c_pad,h_500,w_500/v1397199699/9348765e39d2b3abe60ec8e044d7295b.jpg",Sensory Networks provides software pattern matching and content processing acceleration solutions for network security equipment vendors.,2003.0,Software,"1 Regent St., Suite 18, Chippendale, New South Wales, Australia",Chippendale,New South Wales,Australia,"Sensory Networks is a provider of software pattern matching and content processing acceleration solutions that enable network security equipment vendors to significantly improve the price/performance of their platforms that support resource intensive applications such as Antivirus AV, Intrusion Prevention IPS applications and Content Filtering.The Company's HyperScan pattern-matching software and FastChannel accelerator libraries, running on low cost off the shelf platforms, are designed to operate with a wide range of applications, both commercial and open-source, providing up to 30Gbps throughput performance.",http://sensorynetworks.com,,Intel,Intel acquired Sensory Networks in 2013,http://api.crunchbase.com/v/2/organization/sensory-networks?user_key=0ebdc8274e821149894a240090945265
Wind River,http://www.crunchbase.com/organization/wind-river,"http://a1.images.crunchbase.com/image/upload/c_pad,h_500,w_500/v1397180337/5f6f1e56bf3e5bb4d7719565b0bd9a81.gif","Wind River enables companies to develop, run and manage device software faster and more reliably at a lower cost.",1981.0,Software,"500 Wind River Way, Alameda, California, United States",Alameda,California,United States,"Wind River provides Device Software Optimization DSO. Wind River enables companies to develop, run and manage device software faster, better, at lower cost and more reliably. Wind River platforms are pre-integrated, fully standardized, enterprise-wide development solutions. They reduce effort, cost and risk and optimize quality and reliability at all phases of the device software development process, from concept to deployed product.Founded in 1981, Wind River is headquartered in Alameda, Calif., with operations worldwide and is a wholly owned subsidiary of Intel Corporation",http://www.windriver.com,http://twitter.com/WindRiver,Intel,Intel acquired Wind River in 2009,http://api.crunchbase.com/v/2/organization/wind-river?user_key=0ebdc8274e821149894a240090945265
Xircom,http://www.crunchbase.com/organization/xircom,,Laptop Networking Manufacturer,1988.0,Web Hosting,"Thousand Oaks, California, United States",Thousand Oaks,California,United States,,,,Intel,Intel acquired Xircom in 2001,http://api.crunchbase.com/v/2/organization/xircom?user_key=0ebdc8274e821149894a240090945265
Altor Networks,http://www.crunchbase.com/organization/altor-networks,"http://a3.images.crunchbase.com/image/upload/c_pad,h_500,w_500/v1397198931/9613fdff4e9ae82e5184c9c636cbfd27.png",Altor Networks provides security solutions for virtual data centers and clouds.,2007.0,Security,"350 Bridge Parkway, Suite 6, Redwood City, California, United States",Redwood City,California,United States,"Altor is giving customers unprecedented visibility into and granular control over virtual network traffic. Purpose-built for virtual environments, its Altor VF virtual firewall is dramatically improving the security of virtual servers in data centers while reducing administrative overhead. The award winning technology has been architected to support multiple virtualization platforms from vendors such as VMware, Microsoft, and Citrix. Multi-platform support will allow enterprises to use whatever virtualization products they need, now and in the future.Altor Networks' pioneering innovations include:Enforcing a rule-based security policy on a single VM or group of VMsSecuring VMs during VMotion events, without dropping connectionsEnabling low cost intrusion detection in the virtual network by mirroring selected traffic to external devicesEnforcing a default policy automatically on newly created or â€œrogueâ€ VMs",http://www.altornetworks.com,,Juniper Networks,Juniper Networks acquired Altor Networks in 2010,http://api.crunchbase.com/v/2/organization/altor-networks?user_key=0ebdc8274e821149894a240090945265
Contrail Systems,http://www.crunchbase.com/organization/contrail-systems,"http://a4.images.crunchbase.com/image/upload/c_pad,h_500,w_500/v1397202542/941b1c129afccf1d077319fd4a02440c.png",Contrail Systems is a startup focused on software-defined networking (SDN) by developing an open-source network virtualization platform.,,Software,"2350 Mission College Blvd, Suite 1140, Santa Clara, California, United States",Santa Clara,California,United States,,http://www.contrailsystems.com,,Juniper Networks,Juniper Networks acquired Contrail Systems in 2012,http://api.crunchbase.com/v/2/organization/movirtu?user_key=0ebdc8274e821149894a240090945265
Kagoor Networks,http://www.crunchbase.com/organization/kagoor-networks,"http://a3.images.crunchbase.com/image/upload/c_pad,h_500,w_500/v1397195577/9276e3ba5b5dfdbe9eac9960d44e0aa4.jpg",Kagoor Networks is engaged in the supply and innovation of session border control technology solutions.,,,,,,,"Kagoor Networks is engaged in the supply and innovation of session border control technology solutions that ensures the delivery of internet protocol communications services.The company provides a series of VoiceFlow session border controllers. It offers solutions for the security, network address translation, interoperability, service level assurance, and regulatory compliance sectors. The company also manages a research and development facility in Herzeliya, Israel.Kagoor Networks was founded in 2000 in San Mateo, California. It was acquired by Juniper Networks on May 1, 2005.",,,Juniper Networks,Juniper Networks acquired Kagoor Networks in 2005,http://api.crunchbase.com/v/2/organization/kagoor-networks?user_key=0ebdc8274e821149894a240090945265
NetScreen Technologies,http://www.crunchbase.com/organization/netscreen-technologies,,network security solution,1997.0,Security,"805 11th Avenue, Building Three, Sunnyvale, California, United States",Sunnyvale,California,United States,"As of April 16, 2004, NetScreen Technologies, Inc. was acquired by Juniper Networks, Inc. NetScreen Technologies, Inc. engages in developing, marketing, and selling integrated network security solutions. The security solutions provide key security technologies, such as virtual private networking, denial of service protection, firewall, and intrusion detection and prevention. Virtual private networks allow access to an internal network through the Internet or other untrusted network to securely connect two or more locations, as well as remote users. Firewalls help prevent unauthorized network access by establishing a perimeter defense between two networks, such as an enterprise's network and the Internet. Intrusion detection and prevention appliances detect network attacks using sophisticated detection methods. Besides, the company provides its customers hands-on training classes, testing and certification, and professional services. Domestically, it sells directly to major carriers and through value-added resellers and a distributor to end customers. Internationally, NetScreen sells primarily through distributors, who, in turn, sell to value-added resellers. Its products are sold to end customers, such as established companies and large carriers, including traditional local and long distance telephone companies, Internet carriers, managed security service providers, Internet data center operators, metropolitan area network carriers, and government entities. The company was incorporated in 1997.",,,Juniper Networks,Juniper Networks acquired NetScreen Technologies in 2004,http://api.crunchbase.com/v/2/organization/netscreen-technologies?user_key=0ebdc8274e821149894a240090945265
