Company,CrunchBase Profile,Image,Tagline,Year Founded,Market Categories,Address (HQ),City (HQ),State / Region (HQ),Country (HQ),Description,Homepage,Twitter,Acquired by,Acquisitions ID,API
Milo,http://www.crunchbase.com/organization/milo,"http://a3.images.crunchbase.com/image/upload/c_pad,h_500,w_500/v1397207167/3521c8a507f3c5f65c710eadd6e76d72.png","Milo, a product search space, enables shoppers to research products online and buy locally while tracking real-time availability and price.",2008.0,"Reviews and Recommendations, Real Time, Curated Web, Software, Comparison Shopping, Shopping, Local","170A University Ave., Palo Alto, California, United States",Palo Alto,California,United States,"Milo.com is a free Web site that enables shoppers to research products online and buy local, providing the best of both worlds. The leader in the local product search space, Milo.com tracks the real-time availability and prices of more than 2 million products at over 48,000 stores across the U.S. By combining the resources of the Web and the immediacy of local stores, Milo.com makes it easy for shoppers to research the best products, find the right prices and check where products are available near them. Shoppers save time and money, get to see and try products before they buy them and get the product they want right when they want it. Retailers with products listed on Milo.com can better compete with e-commerce and can use the Site to drive valuable intent-based foot traffic into their stores. Based in Palo Alto, Calif., Milo.com boasts leadership from comScore and Google, and is backed by True Ventures and prominent Silicon Valley investors and entrepreneurs from Mint.com, PayPal, Yelp, YouTube, and others.",http://milo.com,http://twitter.com/miloshopping,eBay,eBay acquired Milo in 2010,http://api.crunchbase.com/v/2/organization/milo?user_key=0ebdc8274e821149894a240090945265
PayPal,http://www.crunchbase.com/organization/paypal,"http://a5.images.crunchbase.com/image/upload/c_pad,h_500,w_500/v1397180767/cbbea0dfa4dd0e14d31f3f912916ce64.jpg",PayPal is an online payment gateway providing users a method to pay and get paid across the internet.,1998.0,"P2P Money Transfer, Payments, Finance, E-Commerce, Databases","2211 N. First Street, San Jose, California, United States",San Jose,California,United States,"PayPal enables users to make money transactions for products purchased online anywhere at any time. All payments and transactions could be carried out through credit cards, bank accounts, PayPal Smart Connect or account balances, without sharing financial information.PayPal has quickly become a global leader in online payment solutions with more than 153 million accounts worldwide. Available in 190 markets and 24 currencies around the world, PayPal enables global ecommerce by making payments possible across different locations, currencies, and languages.PayPal has received more than 20 awards for excellence from the internet industry and the business community -most recently the 2006 Webby Award for Best Financial Services Site and the 2006 Webby People's Voice Award for Best Financial Services Site.Located in San Jose, California, PayPal was founded in 1998 and was acquired by eBay in 2002.",http://www.paypal.com,http://twitter.com/PayPalTR,eBay,eBay acquired PayPal in 2002,http://api.crunchbase.com/v/2/organization/paypal?user_key=0ebdc8274e821149894a240090945265
Shopping.com,http://www.crunchbase.com/organization/shopping-com,"http://a2.images.crunchbase.com/image/upload/c_pad,h_500,w_500/v1397181177/46015b76da4226bfd1cbb0deb88c7f40.png",Shopping.com is a global online shopping comparison website allowing consumers to compare prices and read product reviews.,1998.0,"Curated Web, Shopping","8000 Marina Blvd., 5th Floor, Brisbane, California, United States",Brisbane,California,United States,"Shopping.com is the leading, global on-line shopping comparison network. Consumers and merchants are our customers. We help consumers access the world's largest selection of products from the world's best known retailers and merchants, compare prices and read product reviews. We connect merchants with millions of consumers on Shopping.com and on our partner network with easy to use, performance oriented advertising products.",http://shopping.com,,eBay,eBay acquired Shopping.com in 2005,http://api.crunchbase.com/v/2/organization/shopping-com?user_key=0ebdc8274e821149894a240090945265
StubHub,http://www.crunchbase.com/organization/stubhub,"http://a5.images.crunchbase.com/image/upload/c_pad,h_500,w_500/v1397183829/817926abd9b25dd375bb0890d2bf065e.png",StubHub is an online ticket marketplace enabling fans to buy and sell tickets to entertainment events.,2000.0,"Entertainment, Ticketing, E-Commerce","199 Fremont St, Fl 4, San Francisco, California, United States",San Francisco,California,United States,"StubHub is the world's largest ticket marketplace, enabling fans to buy and sell tickets to tens of thousands of sports, concert, theater and other live entertainment events. StubHub reinvented the ticket resale market in 2000 and continues to lead it through innovation. The company's unique online marketplace, dedicated solely to tickets, provides all fans the choice to buy or sell their tickets in a safe, convenient, and highly reliable environment. All transactions are processed and delivered by StubHub and backed by the company's FanProtect™ Guarantee. Company partners include the San Francisco Giants and University of Texas, along with over 60 teams in the NFL, MLB, NBA, NHL, MLS and NCAA, complemented with companies such as ESPN, AEG, Tickets.com, and Paciolan.StubHub is an eBay company NASDAQ: EBAY. For more information on StubHub, visit www.stubhub.com",http://www.stubhub.com,http://twitter.com/StubHub,eBay,eBay acquired StubHub in 2007,http://api.crunchbase.com/v/2/organization/stubhub?user_key=0ebdc8274e821149894a240090945265
Tradera,http://www.crunchbase.com/organization/tradera,"http://a3.images.crunchbase.com/image/upload/c_pad,h_500,w_500/v1397181352/b764a9c4efc76dec5e71f4777f17faeb.png",Auction site based in Sweden,,Curated Web,"Usa, Kyushu, Japan",Usa,Kyushu,Japan,Auction site based in Sweden,http://tradera.com,,eBay,eBay acquired Tradera in 2006,http://api.crunchbase.com/v/2/organization/tradera?user_key=0ebdc8274e821149894a240090945265
Zong,http://www.crunchbase.com/organization/zong,"http://a5.images.crunchbase.com/image/upload/c_pad,h_500,w_500/v1397185607/93baf17153c1499a785c6a65526e4fd8.jpg",Zong is a mobile payment company allowing user to make micropayments online in gaming and social networking web sites.,2000.0,"Mobile Payments, Payments, Mobile","43 rte des Acacias, Geneva, Geneve, Switzerland",Geneva,Geneve,Switzerland,"Zong, the leading mobile payment service used by online gaming and social networking web sites, converts shoppers into buyers at rates up to 10 times greater than traditional payment methods.Zong leverages direct connections with mobile network operators around the world to provide a secure payment solution with unrivaled connectivity and service quality. Zong is the mobile payment provider for Facebook Credits and also works with hundreds of leading destination websites and mobile applications including Gaia Online, IMVU and Playdom.Reaching over 3.2 billion mobile users, Zong provides localized payment capabilities in close to 50 countries in 21 languages. Zong is the only mobile payments platform that combines the high conversion rates of carrier billing with the low costs and flexibility of payment card networks. In 2011, Zong announced the first one-click mobile payment solution for the Android platform so developers could integrate payment options into their applications. The new payment solution creates a seamless experience for users who can now make a purchase within an application with just one click; no registration or log-in is required. The Zong platform automatically verifies the user, bills their mobile phone account and returns them to their application or game without delay.In 2009, Zong processed mobile payments for over 10 million unique users worldwide.  In October 2009 Zong released Zong+ which combines the high conversion rates of mobile payments with the low costs of payment card networks.  Zong+ received the Frost+Sullivan Best Practices Award for product innovation and was dubbed a ""potential Paypal killer"" by TechCrunch.   In early 2010 Zong was spun off from Switzerland-based Echovox. Echovox shareholders received shares in Zong, a U.S. corporation. Zong is backed by Advent Venture Partners, Newbury Ventures and Matrix Partners.",http://www.zong.com,http://twitter.com/zong,eBay,eBay acquired Zong in 2011,http://api.crunchbase.com/v/2/organization/zong?user_key=0ebdc8274e821149894a240090945265
Data Domain,http://www.crunchbase.com/organization/data-domain,"http://a1.images.crunchbase.com/image/upload/c_pad,h_500,w_500/v1397189925/ce2da32fe20ced6d2d513cd917995b22.png",Data Domain offers disk-to-disk and offsite disaster recovery solutions for businesses.,2001.0,"Software, Enterprise Software","176 South Street, Hopkinton, Massachusetts, United States",Hopkinton,Massachusetts,United States,Data Domain offers disk-to-disk D2D and offsite disaster recovery DR solutions to businesses worldwide.,http://www.emc.com/datadomain,http://twitter.com/emccorp,EMC,EMC acquired Data Domain in 2009,http://api.crunchbase.com/v/2/organization/data-domain?user_key=0ebdc8274e821149894a240090945265
Iomega,http://www.crunchbase.com/organization/iomega,"http://a2.images.crunchbase.com/image/upload/c_pad,h_500,w_500/v1397185974/88159b282ebbb7f85e6ffc81aa6dade1.jpg",Storage and Network Security Solutions,1980.0,Hardware + Software,"10955 Vista Sorrento Parkway, Suite 300, San Diego, California, United States",San Diego,California,United States,"Iomega Corporation is a provider of storage and network security solutions for small and mid-sized businesses, consumers and others. As of April 2008, the company has sold more than 400 milliondigital storage drives and disks.",http://www.iomega.com,,EMC,EMC acquired Iomega in 2008,http://api.crunchbase.com/v/2/organization/iomega?user_key=0ebdc8274e821149894a240090945265
Isilon Systems,http://www.crunchbase.com/organization/isilon,"http://a1.images.crunchbase.com/image/upload/c_pad,h_500,w_500/v1397182721/d7b30b2c195ee7d80997013a3d2bf456.png",Isilon Systems sells clustered file system hardware and software for digital content and other unstructured data sources.,2001.0,Web Hosting,"3101 Western Ave, Seattle, Washington, United States",Seattle,Washington,United States,"As a global leader in scale-out storage, Isilon delivers powerful yet simple solutions for enterprises that want to manage their data, not their storage. Isilon's products are simple to install, manage and scale, at any size. And, unlike traditional architectures, Isilon stays simple no matter how much storage is added, how much performance is required or how business needs change in the future. We're challenging enterprises to think differently about their storage, because when they do, they'll recognize there's a better, simpler way",http://www.isilon.com,,EMC,EMC acquired Isilon Systems in 2010,http://api.crunchbase.com/v/2/organization/isilon?user_key=0ebdc8274e821149894a240090945265
Kazeon,http://www.crunchbase.com/organization/kazeon,"http://a1.images.crunchbase.com/image/upload/c_pad,h_500,w_500/v1397184003/b08ff67dd37da28f1236b2c7f6343172.png",Kazeon Systems develops and provides electronic discovery solutions in the United States.,2003.0,Software,"1161 San Antonio Road, Mountain View, California, United States",Mountain View,California,United States,"Kazeon Systems, Inc. develops and provides electronic discovery solutions in the United States. It offers eDiscovery/litigation support, information security and privacy, governance, and risk and compliance solutions, as well as support and educational services for remote devices over corporate IP networks, VPN networks, and wireless and wired networks. The company also provides Information Center, which helps customers turn their data center into an information center; and Information Server, a software that automates eDiscovery functions from identification, collection through processing, preservation, analysis and review for corporations, service providers, and law firms. In addition, it offers a suite of storage optimization solutions, including data consolidation, migration and archival, file reporting, and backup search. The company was founded in 2003 and is based in Mountain View, California. As of September 30, 2009, Kazeon Systems, Inc. operates as a subsidiary of EMC Corporation.",http://www.kazeon.com,,EMC,EMC acquired Kazeon in 2009,http://api.crunchbase.com/v/2/organization/kazeon?user_key=0ebdc8274e821149894a240090945265
Mozy,http://www.crunchbase.com/organization/mozy,"http://a4.images.crunchbase.com/image/upload/c_pad,h_500,w_500/v1397181481/da7b3129f278fbf3e447913d4dccbec2.jpg",Mozy provides cloud backup and access services and solutions.,2005.0,"Web Hosting, Flash Storage","2162 W. Grove Pkwy, Pleasant Grove, Utah, United States",Pleasant Grove,Utah,United States,"Mozy is the world’s most trusted provider of cloud backup and access, with more than 6 million customers, including more than 100,000 businesses, backing up 90 petabytes of information to its multiple data centers around the globe. Wholly owned by EMC Corporation since 2007, Mozy is an essential component in the EMC backup and recovery solutions portfolio. Mozy is headquartered in Seattle, Washington with offices in Pleasant Grove, Utah; London, England; Cork, Ireland; and Shanghai, China.Mozy has three flagship products -- MozyHome, for consumers, MozyPro, for small businesses, and MozyEnterprise, for larger organizations. MozyHome pricing is $5.99/month for up to 50 GB and 1 computer, and $9.99/month for up to 125 GB and 3 computers. Consumers can add additional computers for $2 per month per computer; or add an additional 20 GB of space for $2 per month. MozyPro pricing is $9.99/month per computer for 10 GB, $19.99/month for 50 GB, $39.99/month for 100 GB, etc. Add a ""server pass"" for another $3.99/month, $6.99/month, $12.99/month, etc.In 2011 Mozy launched the Mozy app for iOS iPhone, iPad and iPod touch and Android devices. The Mozy file sync feature Stash entered public beta in January 2012.On the consumer side, Mozy competes with Carbonite, CrashPlan, and others. At the enterprise level, Iron Mountain and EVault are the entrenched competitors.",http://mozy.com,http://twitter.com/mozy,EMC,EMC acquired Mozy in 2007,http://api.crunchbase.com/v/2/organization/mozy?user_key=0ebdc8274e821149894a240090945265
ScaleIO,http://www.crunchbase.com/organization/scaleio,"http://a3.images.crunchbase.com/image/upload/c_pad,h_500,w_500/v1397191454/9aba7e3cf4651d09222ce8bcc7c44d42.jpg","ScaleIO develops ECS, a solution for data centers to cut storage costs and streamline storage operations.",2011.0,Software,"525 University Avenue, Suite 800, Palo Alto, California, United States",Palo Alto,California,United States,"ScaleIO is the leader in elastic converged storage. ECS, the flagship ScaleIO solution, enables data centers to cut storage costs by over 80% and streamlines storage operations by converging storage into compute. Founded in early 2011 by a team of storage industry veterans who set out to revolutionize enterprise data storage, the company is funded by top-tier venture capital firms, including Greylock Partners and Norwest Venture Partners NVP. ECS is in use at large data centers in the United States and Europe.",http://www.scaleio.com,http://twitter.com/Scaleio,EMC,EMC acquired ScaleIO in 2013,http://api.crunchbase.com/v/2/organization/scaleio?user_key=0ebdc8274e821149894a240090945265
Silver Tail Systems,http://www.crunchbase.com/organization/silver-tail-systems,"http://a1.images.crunchbase.com/image/upload/c_pad,h_500,w_500/v1397198158/a036cebc3522015df24d7cffeb328bce.gif",Silver Tail Systems employs web session intelligence and real-time behavioral analytics to detect and prevent fraud and abuse on websites.,2008.0,"Software, Security, Analytics, Fraud Detection","1010 El Camino Real #300, Menlo Park, California, United States",Menlo Park,California,United States,"Silver Tail Systems is the leading provider of predictive analytics to detect and prevent fraud and abuse on websites.Business logic abuse is a rising concern as its extremely difficult to detect and stop, but these hijack threats, velocity attacks and gaming schemes are costing companies millions, if not billions in online fraud.Silver Tail Forensics and Mitigation products use a new generation of detection, efficient investigation and real-time mitigation of events to track suspicious behavior and divert the bad actors, leaving legitimate users unaffected.",http://www.silvertailsystems.com,http://twitter.com/SilverTailSyst,EMC,EMC acquired Silver Tail Systems in 2012,http://api.crunchbase.com/v/2/organization/silver-tail-systems?user_key=0ebdc8274e821149894a240090945265
VMware,http://www.crunchbase.com/organization/vmware,"http://a5.images.crunchbase.com/image/upload/c_pad,h_500,w_500/v1397187885/d3df44afe422e34d75c9a425cf9c9c08.png",VMware is a software company providing cloud and virtualization services.,1998.0,Software,"3401 Hillview Ave, Palo Alto, California, United States",Palo Alto,California,United States,"VMware, Inc. provides virtualization solutions. The company was founded in 1998 and is headquartered in Palo Alto, California.Its virtualization platform products include Player that enables individuals to run virtual machines on their desktops; Fusion, a desktop virtualization product for users of Intel-based Apple Macintosh computers; Workstation for software developers and enterprise IT professionals; Server, which enables virtual partitioning of a server; ESX Server, an enterprise-class virtualization platform that runs directly on the hardware; Virtual SMP that enables a virtual machine to use four physical processors simultaneously; and VMFS, which allows multiple ESX Servers to share block-based storage.The company also offers VirtualCenter that provides a central point of control to manage a virtualized IT environment; VMotion, which allows users to move virtual machines; DRS that creates resource pools from physical servers; HA, which provides automated recovery from hardware failure; Consolidated Backup that enables LAN-free automated backup of virtual machines; Storage VMotion, which allows live migration of virtual machine disks; Update Manager that automates patch and update management; Capacity Planner, which enables VMware service providers to perform capacity assessments onsite; Converter to convert local and remote physical machines into virtual machines; Lab Manager to automate the setup, capture, storage, and sharing of multi-machine software configurations; ACE that allows desktop administrators to protect company resources against the risks presented by unmanaged desktops; Virtual Desktop Infrastructure to host individual desktops inside virtual machines running on centralized servers; Virtual Desktop Manager, a desktop management server that connects users to virtual desktops in the data center; and VMware Lifecycle Manager that provides control over the virtual environment.",http://www.vmware.com,http://twitter.com/VMware,EMC,EMC acquired VMware in 2004,http://api.crunchbase.com/v/2/organization/vmware?user_key=0ebdc8274e821149894a240090945265
Bolt | Peters,http://www.crunchbase.com/organization/bolt-peters,"http://a3.images.crunchbase.com/image/upload/c_pad,h_500,w_500/v1397191947/f0dc1766a414134a8cf55b1c9d47236e.jpg","Bolt | Peters is a user experience research and design firm that recruits the actual visitors of a website, using their web tool Ethnio.",2002.0,,"576, Natoma St., San Francisco, California, United States",San Francisco,California,United States,"User experience research and design firm in San Francisco. They tap native environment observation and visual storytelling to inspire better design and bring accurate research to design teams and product strategists. Their approach to user research is based on the idea that talking to real users with real motivations matters. Instead of getting their participants through an agency or an email list, they recruit the actual visitors to a website, using their web tool Ethnio. They contact the qualified recruits immediately after they fill out the form to begin the research session right away, watching the way they use your product in real life. They also hold events and workshops, perform expert experience design, and train people in remote user research methods.",http://boltpeters.com,http://twitter.com/boltpeters,Facebook,Facebook acquired Bolt | Peters in 2012,http://api.crunchbase.com/v/2/organization/bolt-peters?user_key=0ebdc8274e821149894a240090945265
Branch,http://www.crunchbase.com/organization/branch,"http://a2.images.crunchbase.com/image/upload/c_pad,h_500,w_500/v1397189471/b7a835153d2a613adaa1aed78755987e.png","Branch Media builds social products to empower conversation, such as a platform for hosting and publishing invite-only conversations.",2011.0,"Messaging, Curated Web","416 W 13th St., Suite 203, New York City, New York, United States",New York City,New York,United States,Branch formerly Roundtable enables a smart new brand of high quality public discourse. Curated groups of people are invited to engage around issues in which they are knowledgeable. This service holds the promise of a new platform for dialogue on the web—a necessary departure from the monologues we have grown so accustomed to reading online.,http://branch.com,http://twitter.com/branch,Facebook,Facebook acquired Branch in 2014,http://api.crunchbase.com/v/2/organization/branch?user_key=0ebdc8274e821149894a240090945265
Chai Labs,http://www.crunchbase.com/organization/chailabs,"http://a1.images.crunchbase.com/image/upload/c_pad,h_500,w_500/v1397185445/c89c48e0b452778bb2a9ece42e232ec4.jpg",Chai Labs offers a semantic search platform that analyzes and extracts insights from real-time data points across the web.,,Software,"Mountain View, California, United States",Mountain View,California,United States,"ChaiLabs is an early stage company comprised of folks from MIT, Stanford, Google, Yahoo, and Cisco, and backed by successful internet investors. Their mission is to build Internet services that are as ubiquitous.  They are located in downtown Mountain View, in the heart of Silicon Valley.Richard Chen has invested in ChaiLabs",http://www.chailabs.com,,Facebook,Facebook acquired Chai Labs in 2010,http://api.crunchbase.com/v/2/organization/chailabs?user_key=0ebdc8274e821149894a240090945265
Face.com,http://www.crunchbase.com/organization/face-com,"http://a3.images.crunchbase.com/image/upload/c_pad,h_500,w_500/v1397205147/b5f707505254d235c56e0bde95a5ed3b.jpg","Face.com employs facial recognition technologies such as Photo Finder, which helps users find photos on social networks like Facebook.",2005.0,Photography,"62 Rothchild Blvd., Tel Aviv, Tel Aviv, Israel",Tel Aviv,Tel Aviv,Israel,"Face.com is helping people find photos, using our home grown best-in-breed facial recognition technologies. The first deployment of our tech is our Photo Finder application for Facebook, today's largest photo sharing site, which scans public photos in your social network and suggests tags for untagged faces. face.com has offices in Tel Aviv and New York.",http://face.com,http://twitter.com/face,Facebook,Facebook acquired Face.com in 2012,http://api.crunchbase.com/v/2/organization/face-com?user_key=0ebdc8274e821149894a240090945265
Hot Potato,http://www.crunchbase.com/organization/hotpotato,"http://a4.images.crunchbase.com/image/upload/c_pad,h_500,w_500/v1397193566/4c2060ffdcc80cd9d5ce779b48626321.png",Hot Potato is a social media agency that provides event-based services.,2009.0,Social Media,"181 N 11th Street, Brooklyn, New York, United States",Brooklyn,New York,United States,"Hot Potato connects friends and fans around live events. We're building tools for real-time social collaboration amongst groups who share an interest in any event or experience as it's happening. Whether checking in, recording your perspective, or just enjoying others contributions, it's more fun to participate in events with Hot Potato.",http://www.hotpotato.com,http://twitter.com/hotpotatoapp,Facebook,Facebook acquired Hot Potato in 2010,http://api.crunchbase.com/v/2/organization/hotpotato?user_key=0ebdc8274e821149894a240090945265
Instagram,http://www.crunchbase.com/organization/instagram,"http://a2.images.crunchbase.com/image/upload/c_pad,h_500,w_500/v1397750972/c28ae01b9b6749e602de8c56fb997597.png","Instagram is a free photo sharing application to take photos, apply filters and share them on social networking services.",2010.0,"Photo Editing, Social Network Media, Photo Sharing, Photography, Social Media, Mobile","P.O. Box 77421, San Francisco, California, United States",San Francisco,California,United States,"Instagram is a free photo sharing application that allows users to take photos, apply a filter, and share it on the service or a variety of other social networking services, including Facebook, Twitter, Foursquare, Tumblr, Flickr, and Posterous The application is compatible with iPhone, iPad or iPod Touch or Android devices running Android.In an homage to both the Kodak Instamatic and Polaroid cameras, Instagram confines photos into a square shape. This is in contrast to the 3:2 aspect ratio normally used by the iOS device cameras.The application was developed by Kevin Systrom and Mike Krieger.In April 2012, Instagram was acquired by Facebook",http://instagram.com,http://twitter.com/instagram,Facebook,Facebook acquired Instagram in 2012,http://api.crunchbase.com/v/2/organization/instagram?user_key=0ebdc8274e821149894a240090945265
