Company,CrunchBase Profile,Image,Tagline,Year Founded,Market Categories,Address (HQ),City (HQ),State / Region (HQ),Country (HQ),Description,Homepage,Twitter,Acquired by,Acquisitions ID,API
DesignArt Networks,http://www.crunchbase.com/organization/designart-networks,"http://a2.images.crunchbase.com/image/upload/c_pad,h_500,w_500/v1397201137/9dd1a2e7b6dab6f0831c228118b63cb3.gif","DesignArt Networks offers SoC platforms and embedded software solutions for mobile LTE, WiMAX and W-CDMA networks.",2006.0,Software,"HaHaroshet St.4, Ra'anana, HaMerkaz, Israel",Ra'anana,HaMerkaz,Israel,"DesignArt Networks DAN is a leading silicon provider for 4G infrastructure products. DesignArt Networks offers software-defined SoC platforms with market-leading performance for compact base stations Enterprise Femto/Pico/Micro, Remote Radio Heads RRH, Backhaul links NLOS, Microwave and E-Band, and relay equipment. Pre-loaded with field-proven SW packs, DAN SoC platforms enable the rapid design of best-of-breed products with the lowest BOM cost and power consumption.",http://www.designartnetworks.com,http://twitter.com/QualcommAtheros,Qualcomm,Qualcomm acquired DesignArt Networks in 2012,http://api.crunchbase.com/v/2/organization/designart-networks?user_key=0ebdc8274e821149894a240090945265
Firethorn,http://www.crunchbase.com/organization/firethorn,"http://a2.images.crunchbase.com/image/upload/c_pad,h_500,w_500/v1397201628/46a57c6f1d693c2c0fdadeebb777578f.gif",Firethorn provides mobile financial services.,2001.0,Mobile,"3333 Piedmont Road, Suite 300, Atlanta, Georgia, United States",Atlanta,Georgia,United States,"Firethorn Holdings LLC provides mobile financial services. The company offers a certified application embedded on select wireless handsets, which enables financial institutions and merchants to deliver branded services to consumers via the mobile device; wireless operators to deliver consumer-convenient and mass-market applications to subscribers; and mobile device users to access and add multiple financial relationships with single password. It integrates application-based banking, bill payment, remote and proximity payments, coupons, marketing, ticketing, and money transfers. The company also provides mobile financial services platform for financial institutions and mobile network operators. In addition, its services include experience in wireless communications, banking, and electronic payments; implementation; customer support; training; and marketing. The company was founded in 2001 and is based in Atlanta, Georgia. As of December 2007, Firethorn Holdings LLC operates as a subsidiary of QUALCOMM, Inc.",http://www.firethorn.com,,Qualcomm,Qualcomm acquired Firethorn in 2007,http://api.crunchbase.com/v/2/organization/firethorn?user_key=0ebdc8274e821149894a240090945265
Pixtronix,http://www.crunchbase.com/organization/pixtronix,"http://a2.images.crunchbase.com/image/upload/c_pad,h_500,w_500/v1397198937/4932725e2e0b4e9dc80449bb05e6f7bd.jpg",Pixtronix is a technology company that develops display technologies optimized for multimedia devices.,2005.0,"Hardware + Software, Displays","300 Ballardvale Street, Suite 123, Wilmington, Massachusetts, United States",Wilmington,Massachusetts,United States,"Pixtronix is an emerging company that develops display technologies optimized for multimedia devices.Headquartered in Andover, Massachusetts and led by experts in the fields of displays, optics and MEMS, Pixtronix's mission is to develop and market the perfect display for today's multimedia lifestyle. Our PerfectLight Displays combine the world's highest optical performance with the lowest power consumption and are designed to scale from mobile devices to desktop displays through HD televisions.",http://www.pixtronix.com,,Qualcomm,Qualcomm acquired Pixtronix in 2011,http://api.crunchbase.com/v/2/organization/pixtronix?user_key=0ebdc8274e821149894a240090945265
Qualcomm Atheros,http://www.crunchbase.com/organization/qualcomm-atheros,"http://a1.images.crunchbase.com/image/upload/c_pad,h_500,w_500/v1397200296/f055d76578407c17da1efb51b6c094df.gif","Qualcomm Atheros offers semiconductor system solutions for the mobile, networking, computing and consumer electronics markets.",1998.0,Hardware + Software,"5480 Great America Parkway, Santa Clara, California, United States",Santa Clara,California,United States,"Qualcomm Atheros formerly Atheros Communications is a leading developer of semiconductor system solutions for wireless and other network communications products. Atheros combines its wireless and networking systems expertise with high-performance radio frequency RF, mixed signal and digital semiconductor design skills to provide highly integrated chipsets that are manufactured on low-cost, standard complementary metal-oxide semiconductor CMOS processes. The Atheros technology is being used by a broad base of leading customers, including personal computer, networking equipment and consumer device manufacturers.Atheros Communications, Inc., was acquired by Qualcomm in May 2011 and began to do business as Qualcomm Atheros.",http://www.atheros.com,,Qualcomm,Qualcomm acquired Qualcomm Atheros in 2011,http://api.crunchbase.com/v/2/organization/qualcomm-atheros?user_key=0ebdc8274e821149894a240090945265
Wilocity,http://www.crunchbase.com/organization/wilocity,"http://a4.images.crunchbase.com/image/upload/c_pad,h_500,w_500/v1397198905/d509807012ecc482083de07a1e799d51.gif",Wilocity develops multi-gigabit wireless chipsets based on WiGig 60GHz standards for the notebook and peripheral markets.,2007.0,Semiconductors,"21 Bareket Street, P.O. Box 3005, Northern Industrial Park, Caesarea, Hefa, Israel",Caesarea,Hefa,Israel,"Wilocity Ltd. develops 60 GHz wireless chipsets for the notebook and peripheral markets. Its wireless solution provides gigabit wireless networking and point-to-point connectivity. The company's gigabit wireless semiconductor solution brings a desktop experience to mobile computers. Wilocity Ltd. was founded in 2007 and is based in Caesarea, Israel.",http://www.wilocity.com,http://twitter.com/WilocityInc,Qualcomm,Qualcomm acquired Wilocity in 2014,http://api.crunchbase.com/v/2/organization/wilocity?user_key=0ebdc8274e821149894a240090945265
Xiam,http://www.crunchbase.com/organization/xiam,"http://a3.images.crunchbase.com/image/upload/c_pad,h_500,w_500/v1397207308/f4f09cebd3d9ce144e3ede6e62de463f.gif","Xiam is a provider of targeted advertising, content discovery, and recommendations solutions for communications providers.",,"Web Development, Mobile","Block S, East Point Business Park, Dublin, Dublin, Ireland",Dublin,Dublin,Ireland,"Xiam is the leading provider of targeted advertising, content discovery and recommendations solutions for communications providers. Xiam's MPOS My Personal Offers System enables communications companies to dramatically improve usage and adoption of digital content and services by presenting highly relevant and targeted offers to customers across all digital channels.",http://www.xiam.com,,Qualcomm,Qualcomm acquired Xiam in 2008,http://api.crunchbase.com/v/2/organization/xiam?user_key=0ebdc8274e821149894a240090945265
Clipboard,http://www.crunchbase.com/organization/clipboard,"http://a4.images.crunchbase.com/image/upload/c_pad,h_500,w_500/v1397180703/9c90c1475cf8e5d68b9e17e19c2d1126.jpg",Clipboard is a web platform allowing users to gather links on various topics and store them online.,2011.0,"Curated Web, Social Bookmarking, Social Media","10220 NE 1st Place, #100, Bellevue, Washington, United States",Bellevue,Washington,United States,"Clipboard was founded by Gary William Flake in January 2011 with the simple goal of helping people save and share the parts of the Web that they care about. Since the Internet is more than two decades old, doesn't it seem strange that the typical way to save something online is to put it into an email or a document? We think so too, which is why we built an easy and powerful tool to help you.All of this may sound simple, but we think it's actually quite significant. We believe that someday soon everyone will be saving and organizing their online life in a way that is easy, fun and reflective of themselves. It is a world where everyone is highly engaged and active in saving their life experiences online.We are here for you and we are in this for the long haul. Our mission is to help you organize your online life. Please read more about us and our values at  on Clipboard: In close to 2 years before Clipboard was acquired in May 2013 140,000 people created 3 million clips.",http://www.clipboard.com,http://twitter.com/clipboard,Salesforce,Salesforce acquired Clipboard in 2013,http://api.crunchbase.com/v/2/organization/clipboard?user_key=0ebdc8274e821149894a240090945265
Desk,http://www.crunchbase.com/organization/assistly,"http://a4.images.crunchbase.com/image/upload/c_pad,h_500,w_500/v1397192833/283a312c64bad7146c1fea7383062b39.png",Desk offers a real-time hosted system for customer interaction management CIM and social customer relationship management SCRM.,2009.0,"Customer Support Tools, Tech Field Support, Customer Service, CRM, SaaS, Enterprise Software","171 2nd Street, Suite 300, San Francisco, California, United States",San Francisco,California,United States,"Desk.com makes it easy for teams and Whole Companies to support customers right from the browser, via email, phone, chat, web, Facebook and Twitter.The company provides hosted, cloud-based customer service platforms for delivering what the company calls ""awesomely responsive"" customer service. The company's all-in-one system helps businesses of all sizes listen to and support customers in real time via email, self service FAQs, chat, and social networks like Twitter.Founded in 2009 by customer service automation veterans Alex Bard, Gary Benitt, Brad Birnbaum, and Jeremy Suriel, the venture-funded company released its first product in September 2010. It has been adopted by leading customer-oriented brands, including Twitter, DirecTV, Bonobos, and Grooveshark. Desk.com's products emphasize social networking, whole company support, powerful agent tools, and web-based self-service. The Desk.com product is a real-time hosted system for both customer interaction management CIM and social customer relationship management SCRM. The platform lets companies bring in support requests from multiple channels -- Twitter, email, live chat, discussion forums, and so on -- and consolidate them in one collaborative desktop that can be accessed by anybody in the organization. The system supports detailed case management customer profiles, history, dispositioning, tracking and interaction management chat, email, callbacks, self service, knowledge base,  twitter, etc.. Desk.com's built-in support for social networks makes it easy for companies to extend their support footprint to social channels like Twitter. Extensive web-based knowledge bases and Q&amp;A discussion forums lower the cost of support and allow customers to help themselves. Usage-based pricing  make it easy for companies to deliver support across all departments, not just customer service. Collaborative tools and unlimited flexible agent accounts help bring development, manufacturing, sales, marketing, and executives into the support-delivery process. Business rules, case filters, automation and bulk management tools help lower the cost of service while increasing overall quality. An integration system connects customer service interactions with web and mobile products, publicly accessible databases and private corporate databases. A robust API makes it easy to build customized integrations and more advanced applications.Desk.com offers the first full-time Agent entirely free, $1 per hour for flexible usage, and $49 per month for additional Agents. Special discounts for startups, non-profits. Built with the small and medium business in mind, also offers professional and enterprise-grade solutions for larger businesses and Fortune 500 companies.",http://www.desk.com,http://twitter.com/desk,Salesforce,Salesforce acquired Desk in 2011,http://api.crunchbase.com/v/2/organization/assistly?user_key=0ebdc8274e821149894a240090945265
Dimdim,http://www.crunchbase.com/organization/dimdim,"http://a4.images.crunchbase.com/image/upload/c_pad,h_500,w_500/v1397184947/c433411bc22ff8ad12c73486c0f14d09.png",Dimdim offers a browser-based web conferencing service based on an open source platform.,2006.0,Curated Web,"900 Chelmsford St, Lowell, Massachusetts, United States",Lowell,Massachusetts,United States,"Dimdim offers a browser based web conferencing service based on the open source platform.  Users can download the open source code and install it to their servers.  Attendees are not required to download any software to host or attend a meeting.  Dimdim allows presenters to share their desktops, show slides, as well as talk, listen, chat, and broadcast via webcam.",http://www.dimdim.com,http://twitter.com/dimdim,Salesforce,Salesforce acquired Dimdim in 2011,http://api.crunchbase.com/v/2/organization/dimdim?user_key=0ebdc8274e821149894a240090945265
ExactTarget,http://www.crunchbase.com/organization/exacttarget,"http://a4.images.crunchbase.com/image/upload/c_pad,h_500,w_500/v1397194363/c8e4293de2c9a31b85a8cbcb93b1de45.jpg",ExactTarget provides on-demand one-to-one email marketing software applications.,2000.0,"Marketing Automation, Email Marketing, Software","20 North Meridian Street, Suite 200, Indianapolis, Indiana, United States",Indianapolis,Indiana,United States,"ExactTarget, Inc. is a provider of on-demand email marketing software solutions. Their suite of on-demand one-to-one marketing applications enables clients to send business-critical and event-triggered communications to increase sales, optimize marketing investments, and strengthen customer relationships. They offer four editions of their on-demand software application along with integrated solutions such as ExactTarget for AppExchange and ExactTarget for Microsoft Dynamics CRM.",http://www.exacttarget.com,http://twitter.com/ExactTarget,Salesforce,Salesforce acquired ExactTarget in 2013,http://api.crunchbase.com/v/2/organization/exacttarget?user_key=0ebdc8274e821149894a240090945265
GoInstant,http://www.crunchbase.com/organization/goinstant,"http://a4.images.crunchbase.com/image/upload/c_pad,h_500,w_500/v1397190710/24c9b1a090f8c088a27a76c37d93b60a.png","GoInstant offers a collaboration API that allows developers to build real-time, multiuser apps.",2010.0,Enterprise Software,"1657 Barrington St, Suite 138, Halifax, Nova Scotia, Canada",Halifax,Nova Scotia,Canada,"GoInstant Co-browsing allows two or more people to browse the web together in a real-time interactive session. All participants that join a co-browse session can click, scroll, type and browse at the same time. Co-browsing does not require any downloads or plugins to work; all users need is a web browser.A co-browse session can be used to co-browse any website for customer support, sales, e-commerce, training and more. Sign up at  to be notified as new accounts become available.",http://goinstant.com,http://twitter.com/GoInstant,Salesforce,Salesforce acquired GoInstant in 2012,http://api.crunchbase.com/v/2/organization/goinstant?user_key=0ebdc8274e821149894a240090945265
Heroku,http://www.crunchbase.com/organization/heroku,"http://a3.images.crunchbase.com/image/upload/c_pad,h_500,w_500/v1397183170/9aa2ba09fe01ba14b18f2264252a9299.jpg","Heroku is a cloud-based platform-as-a-service that allows developers to deploy, scale and manage apps.",2007.0,"Venture Capital, Web Development, Enterprise Software","San Francisco, California, United States",San Francisco,California,United States,"Heroku is the first and best multi-language cloud application platform, or platform-as-a-service.  Heroku allows developers to deploy, scale, and manage their apps without needing to think about servers or systems administration.  Over one million applications have been deployed to Heroku.",http://www.heroku.com,http://twitter.com/heroku,Salesforce,Salesforce acquired Heroku in 2010,http://api.crunchbase.com/v/2/organization/heroku?user_key=0ebdc8274e821149894a240090945265
Jigsaw,http://www.crunchbase.com/organization/jigsaw,"http://a5.images.crunchbase.com/image/upload/c_pad,h_500,w_500/v1397188005/c07e04c3f444c042cc771d11995774b5.jpg",Jigsaw provides business information and data services that leverage user-generated content of the B2B community.,2003.0,"Curated Web, Contact Management","777 Mariners Island Boulevard, 4th Floor, San Mateo, California, United States",San Mateo,California,United States,"Jigsaw  is a leading provider of business information and data services that uniquely leverages user-generated content contributed by its global business-to-business community of 1.5 million members. Jigsaw gives individuals and companies access to business contact information for 24 million business professionals and profiles of 4 million companies. In addition to delivering low-cost and easy access to high-value business information for sales, marketing, recruiting and customer service, Jigsaw provides a variety of cloud-based data acquisition and management services. Founded in 2004, Jigsaw is located in San Mateo, Calif. and is a salesforce.com company.",http://www.jigsaw.com,http://twitter.com/jigsaw,Salesforce,Salesforce acquired Jigsaw in 2010,http://api.crunchbase.com/v/2/organization/jigsaw?user_key=0ebdc8274e821149894a240090945265
RelateIQ,http://www.crunchbase.com/organization/relateiq,,,,,"#N/A, #N/A, #N/A, #N/A",,,,,,,,Salesforce acquired RelateIQ in 2014,http://api.crunchbase.com/v/2/organization/relateiq?user_key=0ebdc8274e821149894a240090945265
Salesforce Buddy Media,http://www.crunchbase.com/organization/buddymedia,"http://a4.images.crunchbase.com/image/upload/c_pad,h_500,w_500/v1397181831/97ba9af14bfc9007dfa420805799dac0.jpg","Salesforce Buddy Media, a social media marketing platform, helps companies build connections and maintain relationships with customers.",2007.0,"Social Media Marketing, Social Network Media, Apps, Software, Media, Social Media, Facebook Applications, Enterprise Software","21 Penn Plaza, 12th Floor, New York City, New York, United States",New York City,New York,United States,"Buddy Media is the social enterprise software of choice for eight of the world's top ten global advertisers, empowering them to build and maintain relationships with their consumers in a connections-based world. The Buddy Media social marketing suite helps brands build powerful connections globally with its scalable, secure architecture and data-driven customer insights from initial point of contact through point of purchase. Buddy Media is headquartered in New York City, with additional offices located in Asia, London, and San Francisco.",http://buddymedia.com,http://twitter.com/BuddyMedia,Salesforce,Salesforce acquired Salesforce Buddy Media in 2012,http://api.crunchbase.com/v/2/organization/buddymedia?user_key=0ebdc8274e821149894a240090945265
Salesforce Japan,http://www.crunchbase.com/organization/salesforce-japan,"http://a1.images.crunchbase.com/image/upload/c_pad,h_500,w_500/v1397189181/38cc7bb27834ca46c86ddd59ef533ae0.png",Salesforce is a corporate enterprise cloud computing.,2000.0,,"Tokyo, Gumma, Japan",Tokyo,Gumma,Japan,Salesforce is a corporate enterprise cloud computing.,http://salesforce.com/jp,http://twitter.com/salesforceJapan,Salesforce,Salesforce acquired Salesforce Japan in 2010,http://api.crunchbase.com/v/2/organization/salesforce-japan?user_key=0ebdc8274e821149894a240090945265
